{
  "schemaVersion": "1.0.0",
  "id": "taiwan-retro-poster",
  "name": {
    "zh": "台灣中世紀旅遊海報",
    "en": "Taiwan Retro Poster"
  },
  "sourceTask": "retro-travel-poster",
  "visual": {
    "mood": [
      "復古",
      "溫暖",
      "建築感",
      "簡約",
      "可收藏",
      "在地真實"
    ],
    "era": "1960–1970 年代東亞鐵道／台灣旅遊海報",
    "palette": {
      "mode": "adaptive",
      "maxColors": 6,
      "swatches": [
        {
          "name": "深海軍藍",
          "hex": null,
          "role": "ink",
          "origin": "explicit"
        },
        {
          "name": "蜂蜜黃",
          "hex": null,
          "role": "accent",
          "origin": "explicit"
        },
        {
          "name": "焦糖棕",
          "hex": null,
          "role": "secondary",
          "origin": "explicit"
        },
        {
          "name": "霧橄欖綠",
          "hex": null,
          "role": "environment",
          "origin": "explicit"
        },
        {
          "name": "舊象牙紙色",
          "hex": null,
          "role": "background",
          "origin": "explicit"
        },
        {
          "name": "少量朱紅",
          "hex": null,
          "role": "highlight",
          "origin": "explicit"
        }
      ],
      "usage": [
        "根據照片主要色彩調整主視覺，但維持同系列印刷配色",
        "朱紅僅用於小面積標記",
        "象牙白紙質底，深藍用作主結構與文字"
      ]
    },
    "geometry": {
      "family": "bold-geometric",
      "motifs": [
        "強透視的建築色面",
        "清晰地標外輪廓",
        "幾何分層陰影",
        "有控制的大塊負空間"
      ],
      "outline": {
        "weight": "medium",
        "character": "printed",
        "color": "深海軍藍"
      },
      "edgeQuality": "geometric-crisp"
    },
    "material": {
      "technique": "screenprint",
      "texture": [
        "細微紙纖維",
        "墨色覆蓋不均",
        "輕量網點",
        "輕微套色錯位"
      ],
      "depth": "graphic-shadow",
      "shadow": "graphic"
    },
    "typography": {
      "display": "中世紀幾何旅遊刊物式字體，不假造漢字或地點名",
      "utility": "簡潔清晰、可辨識的繁體中文字體",
      "hierarchy": "地點／場景／簡短副標／編輯資訊，這是海報資訊層次的參考而非固定字串"
    },
    "composition": {
      "focus": "可辨識的地標與街景透視",
      "whitespace": "generous",
      "layers": "stacked-graphic",
      "notes": [
        "建築主體與遠景保持場景空間關係",
        "強調概括色面與圖像節奏",
        "直式 3:4 只屬原海報輸出格式"
      ]
    }
  },
  "constraints": {
    "must": [
      "若有照片，以照片能支持的景物為最高優先",
      "平塗幾何透視與微妙網印肌理",
      "調色盤克制，保留充足留白"
    ],
    "avoid": [
      "把普通場景改成著名地標",
      "純為『台灣感』加上虛構燈籠、電線、機車或寺廟",
      "霓虹與漸層及塑料 3D",
      "未核實地點的強制自動定位"
    ],
    "conditional": [
      {
        "when": "來源照片有足夠資訊",
        "rule": "保留照片中確實可見的騎樓、機車、標示、鐵路或山景；無照片時禁止假定出現。"
      },
      {
        "when": "有照片且能可靠識別地點",
        "rule": "可以使用地點作為可驗證的海報資產標題；不能可靠識別時採用較廣義位置或保持未定。"
      }
    ]
  },
  "webTranslation": {
    "recommendedBase": "new-style-pack",
    "implementationTier": "new-style-pack",
    "transferable": [
      "深海軍藍與蜜黃／橄欖綠印刷 token",
      "建築幾何英雄圖、粗版畫感層次",
      "幾何字級與簡約但明確的版面分隔",
      "限量朱紅重點標記"
    ],
    "assetTreatment": [
      "真實照片進來才做原場景幾何重建與外形核對",
      "若只給旅程地點，從已確認景點挑可用景觀，不假裝按照片重建"
    ],
    "excludedOriginalInstructions": [
      {
        "instruction": "垂直 3:4、插圖 70–75% 與排版 25–30%",
        "reason": "指定單張旅遊海報比例；響應式網站不能固定此比例。"
      },
      {
        "instruction": "印上 2026 / MR.PARROT — TAIWAN TRAVEL STUDIES / No.xxx",
        "reason": "原創品牌與系列落款不能預設繼承到使用者旅程網站；網站年份以行程真實日期為準。"
      },
      {
        "instruction": "自動偵測並印出 TAIWAN／中英文地名",
        "reason": "沒有照片就不能作影像辨識；旅行網站地點名稱取自使用者行程資料。"
      }
    ],
    "componentRisks": [
      "強透視插圖不可擠壓重要行程文字",
      "隱藏小字或過小字級會影響手機閱讀",
      "非台灣目的地不能自動帶入台灣代表符號"
    ],
    "motion": "inherit"
  },
  "audit": {
    "photoProvided": false,
    "basis": "text-only",
    "unknowns": [
      "沒有原始影像，無法辨識城市、地標及攝影機位置",
      "色系只提供色彩名稱與順序，未提供實際 HEX",
      "原提示品牌版權與系列號不屬旅遊網站"
    ],
    "conflicts": [],
    "assumptions": [
      "只保留印刷美學，跳過原圖 3:4 及指定品牌資訊。"
    ],
    "confidence": "high"
  },
  "stage": "brief-only"
}
